Section,Title,Description
229,Personation of a juror or assessor,"Punishes whoever intentionally personates a juror or assessor with imprisonment up to 2 years, fine, or both"
229A,Failure by person released on bail or bond to appear in Court,Punishes whoever fails to appear before court after release on bail or bond without sufficient cause
230,Coin defined,"Defines coin as metal used as money, stamped and issued by authority to be used as money"
231,Counterfeiting coin,Punishes counterfeiting or performing any part of process of counterfeiting coin with imprisonment up to 7 years and fine
232,Counterfeiting Indian coin,Punishes counterfeiting or any part of process of counterfeiting Indian coin with imprisonment for life or imprisonment up to 10 years and fine
233,Making or selling instrument for counterfeiting coin,"Punishes making, mending or buying, selling, disposing instrument for counterfeiting coin with imprisonment up to 3 years and fine"
234,Making or selling instrument for counterfeiting Indian coin,"Punishes making, mending or buying, selling, disposing instrument for counterfeiting Indian coin with imprisonment up to 7 years and fine"
235,Possession of instrument or material for counterfeiting coin,"Punishes possession of instrument or material for counterfeiting coin with imprisonment up to 3 years and fine, for Indian coin imprisonment up to 10 years and fine"
236,Abetting counterfeiting coin out of India,Punishes abetment out of India of counterfeiting coin in India with same punishment as counterfeiting Indian coin
237,Import or export of counterfeit coin,Punishes import or export of counterfeit coin knowing it to be counterfeit with imprisonment up to 3 years and fine
238,Import or export of counterfeits of Indian coin,Punishes import or export of counterfeits of Indian coin knowing it to be counterfeit with imprisonment for life or imprisonment up to 10 years and fine
239,Delivery of coin possessed with knowledge that it is counterfeit,"Punishes delivery to any person or attempt to induce any person to receive counterfeit coin knowing it to be counterfeit, with imprisonment up to 5 years and fine"
240,Delivery of Indian coin possessed with knowledge that it is counterfeit,"Punishes delivery to any person or attempt to induce any person to receive counterfeit Indian coin knowing it to be counterfeit, with imprisonment up to 10 years and fine"
241,Delivery of coin as genuine which is counterfeit when first possessed,"Punishes delivery of coin, counterfeit when received by deliverer but not known by him to be counterfeit then, as genuine or different coin with imprisonment up to 2 years or fine up to 10 times the value of the coin"
242,Possession of counterfeit coin by person who knew it to be counterfeit when he became possessed,Punishes possession of counterfeit coin by person who knew it to be counterfeit when he took possession with imprisonment up to 3 years and fine
243,Possession of Indian coin by person who knew it to be counterfeit when he became possessed,Punishes possession of counterfeit Indian coin by person who knew it to be counterfeit when he took possession with imprisonment up to 7 years and fine
244,Person employed in mint causing coin to be different from that fixed by law,"Punishes person employed in mint who causes coin issued from that mint to differ from prescribed weight or composition, with imprisonment up to 7 years and fine"
245,Unlawfully taking coining instrument from mint,Punishes unauthorized taking out of mint any coining tool or instrument with imprisonment up to 7 years and fine
246,Fraudulently diminishing weight or altering composition of coin,Punishes fraudulently diminishing weight or altering composition of coin with imprisonment up to 3 years and fine
247,Fraudulently diminishing weight or altering composition of Indian coin,Punishes fraudulently diminishing weight or altering composition of Indian coin with imprisonment up to 7 years and fine
248,Altering appearance of coin with intent that it shall pass as coin of different description,Punishes altering appearance of coin intending it to pass as coin of different description with imprisonment up to 3 years and fine
249,Altering appearance of Indian coin with intent that it shall pass as coin of different description,"Punishes altering appearance of Indian coin intending it to pass as different coin, with imprisonment up to 7 years and fine"
250,Delivery of coin possessed with knowledge that it is altered,"Punishes delivery of coin with altered appearance and knowledge of alteration, as genuine or different coin, with imprisonment up to 5 years and fine"
251,Delivery of Indian coin possessed with knowledge that it is altered,"Punishes delivery of Indian coin with altered appearance and knowledge of alteration, as genuine or different coin, with imprisonment up to 10 years and fine"
252,Possession of coin by person who knew it to be altered when he became possessed,"Punishes possession of altered coin by person who knew it be altered when he took possession, with imprisonment up to 3 years and fine"
253,Possession of Indian coin by person who knew it to be altered when he became possessed,"Punishes possession of altered Indian coin by person who knew it be altered when he took possession, with imprisonment up to 5 years and fine"
254,Delivery of coin as genuine which is altered and not known to be so when possesssed,"Punishes delivery of altered coin, not known to be altered when deliverer took possession, as genuine or different coin, with imprisonment up to 2 years or fine up to 10 times the value of coin"
255,Counterfeiting Government stamp,Punishes counterfeiting or any part of process of counterfeiting Government revenue stamp with imprisonment for life or imprisonment up to 10 years and fine
256,Having possession of instrument or material for counterfeiting Government stamp,Punishes possession of instrument or material for purpose of counterfeiting Government revenue stamp with imprisonment up to 7 years and fine
257,Making or selling instrument for counterfeiting Government stamp,"Punishes making, selling, disposing any instrument for purpose of counterfeiting Government revenue stamp with imprisonment up to 7 years and fine"
258,Sale of counterfeit Government stamp,Punishes sale or offer for sale of any counterfeit Government revenue stamp with imprisonment up to 7 years and fine
259,Having possession of counterfeit Government stamp,"Punishes possession of counterfeit Government revenue stamp to use or dispose as genuine, with imprisonment up to 7 years and fine"
260,Using as genuine a Government stamp known to be counterfeit,Punishes use as genuine of Government revenue stamp known to be counterfeit with imprisonment up to 7 years or fine or both
261,"Effacing writing from substance bearing Government stamp, or removing from document a stamp used for it","Punishes fraudulently removing writing or stamp from document bearing Government revenue stamp, with imprisonment up to 3 years, fine, or both"
262,Using Government stamp known to have been before used,"Punishes fraudulently reusing Government revenue stamp known to have been already used, with imprisonment up to 2 years, fine, or both"
263,Erasure of mark denoting stamp has been used,"Punishes fraudulently erasing mark showing Government revenue stamp to have been used, or possessing such stamp, with imprisonment up to 3 years, fine, or both"
263A,Prohibition of fictitious stamps,"Punishes making, selling, using, possessing fictitious stamps or instruments for making them, seizure and forfeiture of such stamps and instruments"
264,Fraudulent use of false instrument for weighing,"Punishes fraudulent use of false instrument for weighing with imprisonment up to 1 year, fine, or both"
265,Fraudulent use of false weight or measure,"Punishes fraudulent use of false weight or measure with imprisonment up to 1 year, fine, or both"
266,Being in possession of false weight or measure,"Punishes possession of false weight or measure intending it to be fraudulently used, with imprisonment up to 1 year, fine, or both"
267,Making or selling false weight or measure,"Punishes making, selling or disposing false weight or measure to be used as true with imprisonment up to 1 year, fine, or both"
268,Public nuisance,"Offence of public nuisance by doing any act or illegal omission causing common injury, danger or annoyance to public"
269,Negligent act likely to spread infection of disease dangerous to life,"Punishes negligent act likely to spread infection of life-threatening disease with imprisonment up to 6 months, fine, or both"
270,Malignant act likely to spread infection of disease dangerous to life,"Punishes malignant act likely to spread infection of life-threatening disease with imprisonment up to 2 years, fine, or both"
271,Disobedience to quarantine rule,"Punishes disobedience to quarantine rules with imprisonment up to 6 months, fine, or both"
272,Adulteration of food or drink intended for sale,"Punishes adulteration of food or drink to make it noxious, intending to sell it or knowing it is likely to be sold, with imprisonment up to 6 months, fine up to Rs. 1000, or both"
273,Sale of noxious food or drink,"Punishes sale, offer or exposure for sale of noxious food or drink knowing it to be noxious, with imprisonment up to 6 months, fine up to Rs. 1000, or both"
274,Adulteration of drugs,"Punishes adulteration of any drug or medical preparation to lessen efficacy or change operation, intending it to be sold or used as unadulterated, with imprisonment up to 6 months, fine up to Rs. 1000, or both"
275,Sale of adulterated drugs,"Punishes sale, issuance from dispensary, use by any person, of drug or medical preparation known to be adulterated, with imprisonment up to 6 months, fine up to Rs. 1000, or both"
276,Sale of drug as a different drug or preparation,"Punishes knowingly selling, issuing from dispensary, any drug or medical preparation as a different drug or preparation, with imprisonment up to 6 months, fine up to Rs. 1000, or both"
277,Fouling water of public spring or reservoir,"Punishes voluntarily corrupting or fouling water of public spring or reservoir to make it less fit for ordinary use, with imprisonment up to 3 months, fine up to Rs. 500, or both"
278,Making atmosphere noxious to health,"Punishes voluntarily vitiating atmosphere to make it noxious to public health, with fine up to Rs. 500"
279,Rash driving or riding on a public way,"Punishes rash or negligent driving or riding on a public road endangering human life or likely to cause hurt or injury, with imprisonment up to 6 months, fine up to Rs. 1000, or both"
280,Rash navigation of vessel,"Punishes rash or negligent navigation of vessel endangering human life or likely to cause hurt or injury, with imprisonment up to 6 months, fine up to Rs. 1000, or both"
281,"Exhibition of false light, mark or buoy","Punishes exhibition of false light, mark or buoy to mislead navigators, with imprisonment up to 7 years, fine, or both"
282,Conveying person by water for hire in unsafe or overloaded vessel,"Punishes knowingly or negligently conveying person for hire in unsafe or overloaded vessel, with imprisonment up to 6 months, fine up to Rs. 1000, or both"
283,Danger or obstruction in public way or navigation line,"Punishes causing danger, obstruction or injury in any public way or navigation line, with fine up to Rs. 200"
284,Negligent conduct with respect to poisonous substance,"Punishes negligent conduct with poison likely to endanger human life or cause hurt, with imprisonment up to 6 months, fine up to Rs. 1000, or both"
285,Negligent conduct with respect to fire or combustible matter,"Punishes negligent conduct with fire or combustible substance likely to endanger human life or cause hurt, with imprisonment up to 6 months, fine up to Rs. 1000, or both"
286,Negligent conduct with respect to explosive substance,"Punishes negligent conduct with explosive substance likely to endanger human life or cause hurt, with imprisonment up to 6 months, fine up to Rs. 1000, or both"
287,Negligent conduct with respect to machinery,"Punishes negligent conduct with machinery likely to endanger human life or cause hurt, with imprisonment up to 6 months, fine up to Rs. 1000, or both"
288,Negligent conduct with respect to pulling down or repairing buildings,"Punishes negligent omission to take precautions against danger to human life from repair or demolition of buildings, with imprisonment up to 6 months, fine up to Rs. 1000, or both"
289,Negligent conduct with respect to animal,"Punishes negligent omission to take precautions against danger to human life or grievous hurt from any animal, with imprisonment up to 6 months, fine up to Rs. 1000, or both"
290,Punishment for public nuisance in cases not otherwise provided,Punishes public nuisance in cases not specially provided with fine up to Rs. 200
291,Continuance of nuisance after injunction to discontinue,"Punishes continuance of public nuisance after injunction to discontinue, with simple imprisonment up to 6 months, fine, or both"
292,"Sale, etc., of obscene books, etc.","Punishes sale, distribution, possession, publication, import, export of obscene objects"
293,"Sale, etc., of obscene objects to young person","Punishes sale, distribution, exhibition or circulation to persons under 20 years of obscene objects described u/s 292"
294,Obscene acts and songs,"Punishes obscene acts or songs in public places to annoyance of others, with imprisonment up to 3 months, fine, or both"
295,Injuring or defiling place of worship with intent to insult religion,"Punishes destroying, damaging or defiling any place of worship or sacred object to insult religion of any class of persons, with imprisonment up to 2 years, fine, or both"
295A,Deliberate and malicious acts intended to outrage religious feelings,"Punishes acts intended to outrage religious feelings of any class by insulting its religion or beliefs with imprisonment up to 3 years, fine, or both"
296,Disturbing religious assembly,"Punishes voluntarily causing disturbance to any assembly engaged in religious worship or ceremonies, with imprisonment up to 1 year, fine, or both"
297,"Trespassing on burial places, etc.","Punishes trespass on burial places, etc. with intention to wound feelings or insult religion of any person, with imprisonment up to 1 year, fine, or both"
298,"Uttering words, etc., with deliberate intent to wound religious feelings","Punishes uttering any word or making any sound, gesture or exhibit object intending to wound religious feelings of any person, with imprisonment up to 1 year, fine, or both"
299,Culpable homicide,"Defines culpable homicide as causing death with intention, knowledge or reason to believe that act is likely to cause death"
300,Murder,Defines murder and provides punishment of death or life imprisonment along with liability to fine
301,Causing death by act with intention or knowledge that it will likely cause death,Provides punishment for causing death by act done with intention or knowledge that it is likely to cause death
302,Punishment for murder,Prescribes punishment of death or imprisonment for life and liability to fine for murder
303,Punishment for murder by life-convict,Prescribes punishment of death for murder committed by a person under sentence of imprisonment for life
304,Punishment for culpable homicide not amounting to murder,Prescribes punishment of life imprisonment or imprisonment up to 10 years with or without fine for culpable homicide not amounting to murder
304A,Causing death by negligence,"Punishes causing death by rash or negligent act not amounting to culpable homicide, with imprisonment up to 2 years, fine, or both"
304B,Dowry death,Defines and prescribes punishment for dowry death
305,Abetment of suicide of child or insane person,"Punishes abetment of suicide by child or insane or delirious person or idiot, if suicide is committed, with death, imprisonment for life, or imprisonment up to 10 years with or without fine"
306,Abetment of suicide,"Punishes abetment of suicide if suicide is committed, with imprisonment up to 10 years and liability to fine"
307,Attempt to murder,"Punishes attempt to commit murder with imprisonment up to 10 years and liability to fine, imprisonment for life if hurt caused"
308,Attempt to commit culpable homicide,"Punishes attempt to commit culpable homicide not amounting to murder, if hurt is caused with imprisonment up to 7 years with liability to fine"
309,Attempt to commit suicide,"Punishes attempt to commit suicide with simple imprisonment up to 1 year, or fine, or both"
310,Thug,Defines thug when any person habitually commits robbery or child-stealing by means of murder
311,Punishment for being a thug,Prescribes punishment of imprisonment for life and liability to fine for being a thug
312,Causing miscarriage,"Punishes voluntarily causing miscarriage of woman with child, if done to save life then in good faith, with imprisonment up to 3 years, or fine, or both"
313,Causing miscarriage without woman's consent,"Punishes voluntarily causing miscarriage of woman with or without her consent, with imprisonment for life or imprisonment up to 10 years and liability to fine"
314,Death caused by act done with intent to cause miscarriage,"Punishes act done with intent to cause miscarriage, if causing death of woman, with imprisonment up to 10 years and liability to fine, imprisonment for life if done without woman's consent"
315,Act done with intent to prevent child being born alive or to cause it to die after birth,"Punishes act done before birth of child with intent to prevent it from being born alive, or to cause its death after birth, if act prevents child being born alive or causes its death after birth"
316,Causing death of quick unborn child by act amounting to culpable homicide,"Punishes doing an act under such circumstances that if it caused death it would be culpable homicide, and act causes death of a quick unborn child, with imprisonment up to 10 years and liability to fine"
317,Exposure and abandonment of child under twelve years by parent or person having care of it,"Punishes exposure or abandonment of child under 12 years with intent to wholly abandon it, by the parent or person having its care, with imprisonment up to 7 years, fine, or both"
318,Concealment of birth by secret disposal of dead body,"Punishes secretly burying or disposing dead body of child to conceal its birth, with imprisonment up to 2 years, fine, or both"
319,Hurt,"Defines hurt as bodily pain, disease or infirmity caused to any person"
320,Grievous hurt,"Defines grievous hurt and lists the kinds of hurt considered as grievous. Such as Emasculation, Permanent privation of the sight of either eye or hearing of either ear, Privation of any member or joint , Fracture or dislocation of a bone or tooth and Any hurt which endangers life or which causes the sufferer to be during the space of  twenty days"
321,Voluntarily causing hurt,"Punishes voluntarily causing hurt, except in cases under section 334, with imprisonment up to 1 year, fine up to Rs. 1000, or both"
322,Voluntarily causing grievous hurt,"Punishes voluntarily causing grievous hurt, except in cases under section 335, with imprisonment up to 7 years and liability to fine"
323,Punishment for voluntarily causing hurt,Prescribes punishment for voluntarily causing hurt
324,Voluntarily causing hurt by dangerous weapons or means,"Punishes voluntarily causing hurt by dangerous weapons or means, except in cases under section 334, with imprisonment up to 3 years, fine, or both"
325,Punishment for voluntarily causing grievous hurt,Prescribes punishment for voluntarily causing grievous hurt
326,Voluntarily causing grievous hurt by dangerous weapons or means,"Punishes voluntarily causing grievous hurt by dangerous weapons or means, except in cases under section 335, with imprisonment up to 10 years and liability to fine"
326A,"Voluntarily causing grievous hurt by use of acid, etc.","Punishes voluntarily causing grievous hurt by use of acid with imprisonment not less than 10 years up to life, with fine"
326B,Voluntarily throwing or attempting to throw acid,"Punishes voluntarily throwing or attempting to throw acid on any person with imprisonment not less than 5 years up to 7 years, and liability to fine"
327,"Voluntarily causing hurt to extort property, or to constrain to an illegal act","Punishes voluntarily causing hurt to extort property or constrain to an illegal act, with imprisonment up to 10 years and liability to fine"
328,"Causing hurt by means of poison, etc., with intent to commit an offence","Punishes administering poison etc. with intent to cause hurt to commit an offence, with imprisonment up to 10 years and liability to fine"
329,"Voluntarily causing grievous hurt to extort property, or to constrain to an illegal act","Punishes voluntarily causing grievous hurt to extort property or constrain to an illegal act, with imprisonment up to 10 years and liability to fine"
330,"Voluntarily causing hurt to extort confession, or to compel restoration of property","Punishes voluntarily causing hurt to extort confession or information or to compel restoration of property or payment, etc. with imprisonment up to 7 years and liability to fine"
331,"Voluntarily causing grievous hurt to extort confession, or to compel restoration of property","Punishes voluntarily causing grievous hurt to extort confession or information or to compel restoration of property or payment, etc. with imprisonment up to 10 years and liability to fine"
332,Voluntarily causing hurt to deter public servant from his duty,"Punishes voluntarily causing hurt to deter public servant from duty, with imprisonment up to 3 years, fine, or both"
333,Voluntarily causing grievous hurt to deter public servant from his duty,"Punishes voluntarily causing grievous hurt to deter public servant from duty, with imprisonment up to 10 years and liability to fine"
334,Voluntarily causing hurt on provocation,"Punishes voluntarily causing simple hurt on grave and sudden provocation, with imprisonment up to 1 month, fine up to Rs. 500, or both"
335,Voluntarily causing grievous hurt on provocation,"Punishes voluntarily causing grievous hurt on grave and sudden provocation, with imprisonment up to 4 years, fine up to Rs. 2000, or both"
336,Act endangering life or personal safety of others,"Punishes doing any rash or negligent act endangering human life or personal safety of others, with imprisonment up to 3 months, fine up to Rs. 250, or both"
337,Causing hurt by act endangering life or personal safety of others,"Punishes causing hurt by rash or negligent act endangering human life or personal safety of others, with imprisonment up to 6 months, fine up to Rs. 500, or both"
338,Causing grievous hurt by act endangering life or personal safety of others,"Punishes causing grievous hurt by rash or negligent act endangering human life or personal safety of others, with imprisonment up to 2 years, fine up to Rs. 1000, or both"
339,Wrongful restraint,Defines wrongful restraint as obstructing any person from proceeding in any direction where he/she has right to proceed
340,Wrongful confinement,"Whoever wrongfully restrains any person in such a manner as to  prevent that person from proceedings beyond certain circumscribing limits, is said “wrongfully to  confine” that person"
341,Punishment for wrongful restraint,"Punishes wrongful restraint with simple imprisonment up to 1 month, fine up to Rs. 500, or both"
342,Punishment for wrongful confinement,"Punishes wrongful confinement with imprisonment up to 1 year, fine up to Rs. 1000, or both"
343,Wrongful confinement for three or more days,"Punishes wrongful confinement for 3 or more days with imprisonment up to 2 years, or fine, or both"
344,Wrongful confinement for ten or more days,"Punishes wrongful confinement for 10 or more days with imprisonment up to 3 years, and fine"
345,Wrongful confinement of person for whose liberation writ has been issued,"Punishes continuing wrongful confinement of person after writ for liberation has been issued, with imprisonment up to 2 years in addition to any other punishment"
346,Wrongful confinement in secret,"Punishes wrongful confinement in secret with intent to conceal place of confinement, with imprisonment up to 2 years in addition to any other punishment"
347,"Wrongful confinement to extort property, or constrain to illegal act","Punishes wrongful confinement to extort property or constrain to do anything illegal, with imprisonment up to 3 years, and fine"
348,"Wrongful confinement to extort confession, or compel restoration of property","Punishes wrongful confinement to extort confession, information or restoration of property, with imprisonment up to 3 years and fine"
349,Force,"Defines force and its three kinds as bodily force, disposed substances and induced animal motion"
350,Criminal force,"Defines criminal force as intentionally using force without consent to commit an offence, or intending or knowing it likely to cause injury, fear or annoyance"
351,Assault,Defines assault as making gesture or preparation intending or knowing it likely to cause apprehension of criminal force
352,Punishment for assault or criminal force otherwise than on grave provocation,"Punishes assault or criminal force otherwise than on grave and sudden provocation with imprisonment up to 3 months, fine up to Rs. 500, or both"
353,Assault or criminal force to deter public servant from discharge of his duty,"Punishes assault or criminal force to deter public servant from duty with imprisonment up to 2 years, or fine, or both"
354,Assault or criminal force to woman with intent to outrage her modesty,Punishes assault or criminal force to woman intending to outrage her modesty with imprisonment between 1 to 5 years and fine
354A,Sexual harassment,Defines and punishes sexual harassment
