Section,Title,Description
127,Receiving property taken by war or depredation mentioned in sections 125 and 126,"Whoever receives any property knowing the same to have been taken in the commission of any of the offences mentioned in sections 125 and 126, shall be punished with imprisonment of either description for a term which may extend to seven years, and shall also be liable to fine and to forfeiture of the property so received."
128,Public servant voluntarily allowing prisoner of state or war to escape,"Whoever, being a public servant and having the custody of any State prisoner or prisoner of war, voluntarily allows such prisoner to escape from any place in which such prisoner is confined, shall be punished with imprisonment for life, or imprisonment of either description for a term which may extend to ten years, and shall also be liable to fine."
129,Public servant negligently suffering such prisoner to escape,"Whoever, being a public servant and having the custody of any State prisoner or prisoner of war, negligently suffers such prisoner to escape from any place of confinement in which such prisoner is confined, shall be punished with simple imprisonment for a term which may extend to three years, and shall also be liable to fine."
130,"Aiding escape of, rescuing or harbouring such prisoner","Whoever knowingly aids or assists any State prisoner or prisoner of war in escaping from lawful custody, or rescues or attempts to rescue any such prisoner, or harbours or conceals any such prisoner who has escaped from lawful custody, or offers or attempts to offer any resistance to the recapture of such prisoner, shall be punished with imprisonment for life, or with imprisonment of either description for a term which may extend to ten years, and shall also be liable to fine."
131,"Abetting mutiny, or attempting to seduce a soldier, sailor or airman from his duty","Whoever abets the committing of mutiny by an officer, soldier, sailor or airman, in the Army, Navy or Air Force of the Government of India or attempts to seduce any such officer, soldier, sailor or airman from his allegiance or his duty, shall be punished with imprisonment for life, or with imprisonment of either description for a term which may extend to ten years, and shall also be liable to fine."
132,"Abetment of mutiny, if mutiny is committed in consequence thereof","Whoever abets the committing of mutiny by an officer, soldier, sailor or airman, in the Army, Navy or Air Force of the Government of India, shall, if mutiny be committed in consequence of that abetment, be punished with death or with imprisonment for life, or imprisonment of either description for a term which may extend to ten years, and shall also be liable to fine."
133,"Abetment of assault by soldier, sailor or airman on his superior officer, when in execution of his office","Whoever abets an assault by an officer, soldier, sailor or airman, in the Army, Navy or Air Force of the Government of India, on any superior officer being in the execution of his office, shall be punished with imprisonment of either description for a term which may extend to three years, and shall also be liable to fine."
134,"Abetment of such assault, if the assault committed","Whoever abets an assault by an officer, soldier, sailor or airman, in the Army, Navy or Air Force of the Government of India, on any superior officer being in the execution of his office, shall, if such assault be committed in consequence of that abetment be punished with imprisonment of either description for a term which may extend to seven years, and shall also be liable to fine."
135,"Abetment of desertion of soldier, sailor or airman","Whoever, abets the desertion of any officer, soldier, sailor or airman, in the Army, Navy or Air Force of the Government of India, shall be punished with imprisonment of either description for a term which may extend to two years, or with fine, or with both."
136,Harbouring deserter,"Whoever, except as hereinafter excepted, knowing or having reason to believe that an officer, soldier, sailor or airman, in the Army, Navy or Air Force of the Government of India, has deserted, harbours such officer, soldier, sailor or airman, shall be punished with imprisonment of either description for a term which may extend to two years, or with fine or with both."
137,Deserter concealed on board merchant vessel through negligence of master,"The master or person in charge of a merchant vessel, on board of which any deserter from the Army, Navy or Air Force of the Government of India is concealed, shall, though ignorant of such concealment, be liable to a penalty not exceeding five hundred rupees, if he might have known of such concealment but for some neglect of his duty as such master or person in charge, or but for some want of discipline on board of the vessel."
138,"Abetment of act of insubordination by soldier, sailor or airman","Whoever abets what he knows to be an act of insubordination by an officer, soldier, sailor or airman, in the Army, Navy or air Force, of the Government of India, shall, if such act of insubordination be committed in consequence of that abetment, be punished with imprisonment of either description for a term which may extend to six months, or with fine, or with both."
139,Persons subject to certain Acts,"No person subject to the Army Act, the Navy Act or the Air Force Act is subject to punishment under IPC for any of the offences in this Chapter."
140,"Wearing garb or carrying token used by soldier, sailor or airman","Whoever, not being a soldier/sailor/airman, wears garb or carries a token resembling that used by them with intent to be believed to be one, shall be punished with imprisonment up to 3 months, fine up to Rs. 500, or both."
141,Unlawful assembly,"An assembly of 5 or more people to overawe the government/public servant, resist execution of law, commit mischief or criminal trespass, or take/obtain possession of property etc. by criminal force."
142,Being member of unlawful assembly,"Whoever is aware of facts that make an assembly unlawful, and intentionally joins or continues in it."
143,Punishment for unlawful assembly,"Imprisonment up to 6 months, fine, or both."
144,Joining unlawful assembly armed with deadly weapon,"Whoever joins or continues in an armed unlawful assembly shall be punished with imprisonment up to 2 years, fine, or both."
145,"Joining or continuing in unlawful assembly, knowing it has been commanded to disperse","Whoever joins or continues in an unlawful assembly, knowing it has been ordered to disperse, shall be punished with imprisonment up to 2 years, fine, or both."
146,Rioting,"When force/violence is used by an unlawful assembly for its common object, every member is guilty of rioting."
147,Punishment for rioting,"Imprisonment up to 2 years, fine, or both."
148,Rioting armed with deadly weapon,"Whoever commits rioting armed with deadly weapon/offensive item likely to cause death, shall be punished with imprisonment up to 3 years, fine, or both."
149,Every member of unlawful assembly guilty of offence committed in prosecution of common object,"If an offence is committed by any member of an unlawful assembly in prosecution of the common object of that assembly, every person who at the time of the committing of that offence is a member of the same assembly is guilty of that offence."
150,Hiring or conniving at hiring of persons to join unlawful assembly,"Whoever hires or connives at the hiring, engagement, or employment of any person to join or become a member of any unlawful assembly shall be punishable as a member of such unlawful assembly."
151,Knowingly joining or continuing in assembly of five or more persons after it has been commanded to disperse,Whoever knowingly joins or continues in any assembly of five or more persons after such assembly has been lawfully commanded to disperse shall be punished with imprisonment or fine or both.
152,"Assaulting or obstructing public servant when suppressing riot, etc.",Whoever assaults or obstructs any public servant in the discharge of his duty as such public servant in endeavoring to disperse an unlawful assembly or to suppress a riot or affray shall be punished with imprisonment or fine or both.
153,Wantonly giving provocation with intent to cause riot,Whoever malignantly or wantonly by doing anything illegal gives provocation intending or knowing it to be likely to cause the offence of rioting shall be punished with imprisonment or fine or both.
153A,"Promoting enmity between different groups on ground of religion, race, place of birth, residence, language, etc., and doing acts prejudicial to maintenance of harmony","Whoever (a) by words, either spoken or written, or by signs or by visible representations or otherwise, promotes or attempts to promote, on grounds of religion, race, place of birth, residence, language, caste or community or any other ground whatsoever, disharmony or feelings of enmity, hatred or ill will between different religious, racials, language or regional groups or castes or communities, or (b) commits any act which is prejudicial to the maintenance of harmony between different religious, racial, language or regional groups or castes or communities, and which disturbs or is likely  to disturb the public tranquillity. organizes any exercise, movement, drill or other similar activity intending that the  participants in such activity shall use or be trained to use criminal force or violence.Whoever commits an offence in any place of worship"
154,Owner or occupier of land on which an unlawful assembly is held,The owner or occupier of the land upon which an unlawful assembly is held and any person having an interest in such land shall be punishable with fine if they do not give the earliest notice thereof to the nearest police station.
155,Liability of person for whose benefit riot is committed,"Whenever a riot is committed for the benefit or on behalf of any person, such person shall be punishable with fine if he does not use all lawful means in his power to prevent such assembly or riot."
156,Liability of agent of owner or occupier for whose benefit riot is committed,The agent or manager of a person for whose benefit a riot is committed shall be punishable with fine if they do not use all lawful means to prevent such riot or assembly.
157,Harbouring persons hired for an unlawful assembly,"Whoever harbors, receives, or assembles in any house or premises any persons knowing that such persons have been hired, engaged, or employed to join or become members of an unlawful assembly shall be punished with imprisonment or fine or both."
158,Being hired to take part in an unlawful assembly or riot,Whoever is engaged or hired to do or assist in doing any of the acts specified in section 141 shall be punished with imprisonment or fine or both.
159,Affray,"When two or more persons by fighting in a public place disturb the public peace, they are said to “commit an affray”."
160,Punishment for committing affray,Whoever commits an affray shall be punished with imprisonment or fine or both.
161,Public servant taking gratification other than legal remuneration in respect of an official act,A public servant who takes a gratuity for doing or forbearing to do any official act or for showing favor or disfavor in his official capacity shall be punished with imprisonment or fine or both.
162,"Taking gratification, in order, by corrupt or illegal means, to influence public servant",Anyone who takes a gratification to influence a public servant by corrupt or illegal means shall be punished with imprisonment or fine or both.
163,"Taking gratification, for exercise of personal influence with public servant",Whoever accepts gratification for exercising personal influence over a public servant shall be punished with imprisonment or fine or both.
164,Punishment for abetment by public servant of offences defined in sections 162 or 163,A public servant who abets the offences defined in sections 162 or 163 shall be punished with imprisonment or fine or both.
165,"Public servant obtaining valuable thing, without consideration, from person concerned in proceeding or business transacted by such public servant",A public servant who obtains any valuable thing without consideration from a person concerned in any proceeding or business transacted by such public servant shall be punished with imprisonment or fine or both.
165A,Punishment for abetment of offences defined in section 161 or section 165,Whoever abets any offence punishable under section 161 or section 165 shall be punished with imprisonment or fine or both.
166,"Public servant disobeying law, with intent to cause injury to any person",A public servant who knowingly disobeys any direction of the law intended to cause injury to any person shall be punished with imprisonment or fine or both.
166B,Punishment for non-treatment of victim,"Whoever, being in charge of a hospital, public or 
private, whether run by the Central Government, the State Government, local bodies or any other person, 
contravenes the provisions of section 357C of the Code of Criminal Procedure, 1973 (2 of 1974), shall be 
punished with imprisonment for a term which may extend to one year or with fine or with both."
167,Public servant framing an incorrect document with intent to cause injury,A public servant who frames an incorrect document with intent to cause injury shall be punished with imprisonment or fine or both.
168,Public servant unlawfully engaging in trade,A public servant who engages in trade or business in contravention of any law shall be punished with imprisonment or fine or both.
169,Public servant unlawfully buying or bidding for property,A public servant who unlawfully buys or bids for property shall be punished with imprisonment or fine or both.
170,Personating a public servant,Whoever personates a public servant shall be punished with imprisonment or fine or both.
171,Wearing garb or carrying token used by public servant with fraudulent intent,"Whoever, not being a public servant, wears any garb or carries any token resembling any garb or token used by a public servant with fraudulent intent shall be punished with imprisonment or fine or both."
172,Absconding to avoid service of summons or other proceeding,"Absconding to avoid being served with a summons, notice, or order from any public servant shall be punished with imprisonment or fine or both."
171,Wearing garb or carrying token used by public servant,"Whoever, not being a soldier, sailor or airman in the Military, Naval or Air service of the Government of India, wears any garb or carries any token resembling any garb or token used by such soldier, sailor or airman with the intention that it may be believed that he is such a soldier, sailor or airman, shall be punished with imprisonment"
171A,Candidate and electoral right,"Definitions of ""candidate"" and ""electoral right"" for purposes of Chapter IXA"
171B,Bribery,Offence of bribery during elections
171C,Undue influence at elections,Offence of undue influence during elections
171D,Personation at elections,Offence of personation during elections
171E,Punishment for bribery,Punishment for offence of bribery during elections
171F,Punishment for undue influence or personation at an election,Punishment for offences of undue influence or personation during elections
171G,False statement in connection with an election,Offence of making false statements relating to personal character or conduct of a candidate during elections
171H,Illegal payments in connection with an election,Offence of making illegal payments for promoting or procuring the election of a candidate
171-I,Failure to keep election accounts,Offence of failure to keep accounts of election expenses
172,Absconding to avoid service of summons or other proceeding,"Offence of absconding to avoid service of summons, notice or order from a public servant"
173,"Preventing service of summons or other proceedings, or preventing publication thereof","Offence of intentionally preventing service of summons, notice or order issued by a public servant"
174,Non-attendance in obedience to an order from public servant,Offence of non-attendance in obedience to an order from a public servant
174A,Non-appearance in response to a proclamation under section 82 of Act 2 of 1974,Offence of non-appearance in response to a proclamation under section 82 of CrPC 1973
175,Omission to produce document or electronic record to public servant by person legally bound to produce it,Offence of omission to produce document or electronic record to public servant by person legally bound
176,Omission to give notice or information to public servant by person legally bound to give it,Offence of omission to give notice or information to public servant by person legally bound
177,Furnishing false information,Offence of furnishing false information to a public servant
178,Refusing oath or affirmation when duly required by public servant to make it,Offence of refusing to take oath or affirmation when required by a public servant
179,Refusing to answer public servant authorized to question,Offence of refusing to answer questions from a public servant authorized to question
180,Refusing to sign statement,Offence of refusing to sign statement made to a public servant when required
181,False statement on oath or affirmation to public servant or person authorized to administer an oath or affirmation,Offence of making false statement under oath or affirmation to a public servant or other authorized person
182,"False information, with intent to cause public servant to use his lawful power to the injury of another person",Offence of providing false information to a public servant intending to cause injury to any person
183,Resistance to the taking of property by the lawful authority of a public servant,Offence of resisting or obstructing taking of property by lawful authority of public servant
184,Obstructing sale of property offered for sale by authority of public servant,Offence of obstructing sale of property offered for sale by lawful authority of public servant
185,Illegal purchase or bid for property offered for sale by authority of public servant,Offence related to illegal purchase or bid for property offered for sale by authority of public servant
186,Obstructing public servant in discharge of public functions,Offence of obstructing a public servant in discharge of his public functions
187,Omission to assist public servant when bound by law to give assistance,Offence of intentional omission to assist a public servant when legally bound to do so
188,Disobedience to order duly promulgated by public servant,Offence of disobeying an order promulgated by a public servant
189,Threat of injury to public servant,Offence of threatening injury to a public servant
190,Threat of injury to induce person to refrain from applying for protection to public servant,Offence of giving threat to prevent a person from seeking protection from a public servant
191,Giving false evidence,Offence of intentionally giving false evidence in a judicial proceeding
192,Fabricating false evidence,Offence of fabricating or making false evidence with intent to use it in a judicial proceeding
193,Punishment for false evidence,Punishment for offences under sections 191 and 192
194,Giving or fabricating false evidence with intent to procure conviction of capital offence,Offence of giving or fabricating false evidence intending to procure conviction punishable with death
195,Giving or fabricating false evidence with intent to procure conviction of offence punishable with imprisonment for life or imprisonment,Offence of giving or fabricating false evidence to procure conviction punishable with life imprisonment or imprisonment
196,Using evidence known to be false,Offence of corruptly using as true evidence known to be false
197,Issuing or signing false certificate,Offence of issuing or signing false certificate required to be given by law
198,Using as true a certificate known to be false,Offence of corruptly using a false certificate as true knowing it to be false
199,False statement made in declaration which is by law receivable as evidence,Offence of making false statement in a declaration receivable as evidence by law
200,Using as true such declaration knowing it to be false,Offence of corruptly using as true a declaration known to be false
201,"Causing disappearance of evidence of offence, or giving false information to screen offender",Offence of causing disappearance of evidence or giving false information to screen offender
202,Intentional omission to give information of offence by person bound to inform,Offence of intentional omission to give information of offence by person legally bound to inform
203,Giving false information respecting an offence committed,Offence of giving false information regarding an offence to screen offender
204,Destruction of document or electronic record to prevent its production as evidence,Offence of destroying document or electronic record to prevent its production as evidence
205,False personation for purpose of act or proceeding in suit or prosecution,Offence of false personation for the purpose of any act or proceeding in a suit or criminal prosecution
206,Fraudulent removal or concealment of property to prevent its seizure as forfeited or in execution,Offence relating to fraudulent removal of property to prevent its seizure for forfeiture or execution of decree
207,Fraudulent claim to property to prevent its seizure as forfeited or in execution,Offence relating to fraudulent claim made to prevent seizure of property for forfeiture or execution of decree
208,Fraudulently suffering decree for sum not due,Offence of fraudulently suffering decree for a sum not due
209,Dishonestly making false claim in Court,Offence of making false claim in court with intent to injure or annoy any person
210,Fraudulently obtaining decree for sum not due,Offence of fraudulently obtaining decree for sum not due
211,False charge of offence made with intent to injure,Offence of instituting criminal proceedings against a person with intent to cause injury
212,Harbouring offender,Offence of harbouring an offender who has committed an offence punishable with death or imprisonment
213,"Taking gift, etc., to screen an offender from punishment",Offence of taking gratification to screen an offender from punishment
214,Offering gift or restoration of property in consideration of screening offender,Offence of offering gratification or restoration of property in consideration of screening offender
215,"Taking gift to help to recover stolen property, etc",Offence of taking gratification to help recover stolen property without efforts to apprehend offender
216,Harbouring offender who has escaped from custody or whose apprehension has been ordered,Offence of harbouring offender who has escaped from custody or who has been ordered to be apprehended
216A,Penalty for harbouring robbers or dacoits,Offence of harbouring robbers or dacoits
217,Public servant disobeying direction of law with intent to save person from punishment or property from forfeiture,Offence of public servant disobeying law intending to save person from punishment or property from forfeiture
218,Public servant framing incorrect record or writing with intent to save person from punishment or property from forfeiture,Offence of public servant framing incorrect record intending to save person from punishment or property from forfeiture
219,"Public servant in judicial proceeding corruptly making report, etc., contrary to law","Offence of public servant corruptly making false report, order or decision during judicial proceeding"
220,Commitment for trial or confinement by person having authority who knows that he is acting contrary to law,"Offence by public servant vested with legal authority of committing persons for trial or confining, contrary to law"
221,Intentional omission to apprehend on the part of public servant bound to apprehend,Offence of intentional omission by public servant to apprehend person under legal obligation to do so
222,Intentional omission to apprehend on the part of public servant bound to apprehend person under sentence or lawfully committed,Offence of intentional omission by public servant to apprehend sentenced person
223,Escape from confinement or custody negligently suffered by public servant,Offence of negligently suffering prisoner to escape by public servant responsible for keeping such person in confinement or custody
224,Resistance or obstruction by a person to his lawful apprehension,Offence of resisting or obstructing lawful apprehension of self
225,Resistance or obstruction to lawful apprehension of another person,Offence of resisting or obstructing lawful apprehension of another person
225B,"Resistance or obstruction to lawful apprehension, or escape or rescue","This legal provision, Section 225B, addresses resistance or obstruction to lawful apprehension, escape, or rescue in cases not covered by Section 224 or Section 225, or any other existing law. It stipulates that anyone intentionally impeding their own or another person's lawful apprehension, attempting to escape lawful custody, or trying to rescue someone from legal detention can be punished."
227,Violation of condition of remission of punishment,Punishes whoever violates any condition on which remission of punishment was granted
228,Intentional insult or interruption to public servant sitting in judicial proceeding,"Punishes whoever intentionally offers insult or causes interruption to a public servant in a judicial proceeding with simple imprisonment up to 6 months, fine up to Rs. 1000, or both"
228A,Disclosure of identity of the victim of certain offences,Punishes disclosure of identity of victim of certain sexual offences without prior permission
