Section,Title,Description
354B,Assault or use of criminal force to woman with intent to disrobe,"Punishes assault or criminal force to any woman intending to disrobe her, with imprisonment between 3 to 7 years and fine"
354C,Voyeurism,"Punishes voyeurism with imprisonment between 1 to 3 years on first conviction, and between 3 to 7 years on subsequent conviction, and fine"
354D,Stalking,Defines and punishes stalking of a woman
355,Assault or criminal force with intent to dishonour person,"Punishes assault or criminal force with intent to dishonour a person, with imprisonment up to 2 years, or fine, or both"
356,Assault or criminal force in attempt to commit theft of property,"Punishes assault or criminal force in attempting to commit theft on any person's property, with imprisonment up to 2 years, or fine, or both"
357,Assault or criminal force in attempt wrongfully to confine a person,"Punishes assault or criminal force to wrongfully confine any person, with imprisonment up to 1 year, or fine up to Rs. 1000, or both"
358,Assault or criminal force on grave provocation,"Punishes assault or criminal force on grave and sudden provocation, with simple imprisonment up to 1 month, or fine up to Rs. 200, or both"
359,Kidnapping,Defines kidnapping and its two kinds - kidnapping from India and kidnapping from lawful guardianship
360,Kidnapping from India,Defines and punishes kidnapping of any person from India without consent or legal authority
361,Kidnapping from lawful guardianship,Defines and punishes kidnapping of a minor or person of unsound mind from lawful guardianship without consent
362,Abduction,"Defines abduction as compelling, deceiving or inducing any person to go from any place"
363,Punishment for kidnapping,Punishes kidnapping from India or lawful guardianship with imprisonment up to 7 years and fine
363A,Kidnapping or maiming a minor for purposes of begging,"Punishes kidnapping or maiming of minor for purposes of begging, employing or using minor for begging, with imprisonment up to 10 years and fine"
364,Kidnapping or abducting in order to murder,"Punishes kidnapping or abducting any person in order to murder, with imprisonment for life or up to 10 years and fine"
364A,"Kidnapping for ransom, etc.","Punishes kidnapping for ransom, threatening to cause death or hurt, with death, imprisonment for life, or imprisonment up to 10 years and fine"
365,Kidnapping or abducting with intent secretly and wrongfully to confine person,"Punishes kidnapping or abducting intending to secretly and wrongfully confine the person, with imprisonment up to 7 years and fine"
366,"Kidnapping, abducting or inducing woman to compel her marriage","Punishes kidnapping or abducting any woman to compel her marriage or to force or seduce her to illicit intercourse, with imprisonment up to 10 years and fine"
366A,Procuration of minor girl,"Punishes procuring minor girl for purposes of sexual intercourse, with imprisonment up to 10 years and fine"
366B,Importation of girl from foreign country,"Punishes importing girl below 21 years into India for purposes of sexual intercourse, with imprisonment up to 10 years and fine"
367,"Kidnapping or abducting in order to subject person to grievous hurt, slavery, etc.","Punishes kidnapping or abducting any person in order to subject them to grievous hurt, slavery, lust, etc. with imprisonment up to 10 years and fine"
368,"Wrongfully concealing or keeping in confinement, kidnapped or abducted person","Punishes wrongfully concealing or confining kidnapped or abducted person, in the same manner as kidnapping or abducting"
369,Kidnapping or abducting child under ten years with intent to steal from its person,"Punishes kidnapping or abducting child under 10 years to steal from their person, with imprisonment up to 7 years and fine"
370,Trafficking of person,"Defines and punishes trafficking of persons for exploitation, forced labour, begging, organ trade, etc."
370A,Exploitation of a trafficked person,"Punishes exploitation of a trafficked minor for commercial sexual exploitation, with rigorous imprisonment between 5 to 7 years and fine"
371,Habitual dealing in slaves,"Punishes habitual dealing in slaves, with imprisonment for life or imprisonment up to 10 years and fine"
372,"Selling minor for purposes of prostitution, etc.","Punishes buying or disposing of any person under 18 years for purposes of prostitution or illicit intercourse, with imprisonment up to 10 years and fine"
373,"Buying minor for purposes of prostitution, etc.","Punishes buying or obtaining possession of any person under 18 years for purposes of prostitution or illicit intercourse, with imprisonment up to 10 years and fine"
374,Unlawful compulsory labour,"Punishes compelling any person to labour against their will, with imprisonment up to 1 year or fine or both"
375,Rape,Defines and punishes offence of rape
376,Punishment for rape,Prescribes punishment for offence of rape
376A,Punishment for causing death or resulting in persistent vegetative state of victim,"Punishes rape resulting in death or persistent vegetative state of victim, with imprisonment between 20 years to life or death"
376AB,Punishment for rape on woman under twelve years of age,"Punishes rape of woman under 12 years with imprisonment for life or death, and fine"
376B,Sexual intercourse by husband upon his wife during separation,"Punishes sexual intercourse by husband with his wife during separation without her consent, with imprisonment between 2 to 7 years and fine"
376C,Sexual intercourse by a person in authority,"Punishes sexual intercourse by person in authority or fiduciary relationship abusing that position, with imprisonment between 5 to 10 years and fine"
376D,Gang rape,"Punishes gang rape, with rigorous imprisonment between 20 years to life, and fine"
376DA,Punishment for gang rape on woman under sixteen years of age,"Punishes gang rape of woman under 16 years, with imprisonment for life and fine"
376DB,Punishment for gang rape on woman under twelve years of age,"Punishes gang rape of woman under 12 years, with imprisonment for life to death, and fine"
376E,Punishment for repeat offenders,"Punishes repeat offenders of rape, with imprisonment for life or death"
377,Unnatural offences,Punishes voluntary carnal intercourse against order of nature with imprisonment for life or imprisonment up to 10 years and fine
378,Theft,Defines theft
379,Punishment for theft,"Prescribes punishment for theft with imprisonment up to 3 years, or fine, or both"
380,"Theft in dwelling house, etc.","Punishes theft in building used as human dwelling or for custody of property, with imprisonment up to 7 years and fine"
381,Theft by clerk or servant of property in possession of master,"Punishes theft by clerk or servant of property in possession of master, with imprisonment up to 7 years and fine"
382,"Theft after preparation made for causing death, hurt or restraint in order to the committing of the theft","Aggravated form of theft after preparation made for causing death, hurt or restraint, punished with imprisonment up to 10 years and fine"
383,Extortion,Defines offence of extortion by putting a person in fear of injury in order to dishonestly induce delivery of property or valuable security
384,Punishment for extortion,"Punishes extortion with imprisonment up to 3 years, or fine, or both"
385,Putting person in fear of injury in order to commit extortion,"Punishes putting or attempting to put any person in fear in order to commit extortion, with imprisonment up to 2 years, or fine, or both"
386,Extortion by putting a person in fear of death or grievous hurt,"Aggravated form of extortion by putting any person in fear of death or grievous hurt, punished with imprisonment up to 10 years and fine"
387,"Putting person in fear of death or of grievous hurt, in order to commit extortion","Punishes putting or attempting to put any person in fear of death or grievous hurt in order to commit extortion, with imprisonment up to 7 years and fine"
388,Extortion by threat of accusation of an offence punishable with death or imprisonment for life,"Punishes extortion by threat of accusation of capital offence, with imprisonment up to 10 years and fine"
389,"Putting person in fear of accusation of offence, in order to commit extortion","Punishes putting person in fear of accusation of capital or other offence, in order to commit extortion, with imprisonment up to 10 years and fine"
390,Robbery,Defines robbery as theft or extortion accompanied with violence or threat
391,Dacoity,Defines and punishes offence of dacoity by five or more persons
392,Punishment for robbery,Punishes robbery with rigorous imprisonment up to 10 years and fine
393,Attempt to commit robbery,Punishes attempted robbery with rigorous imprisonment up to 7 years and fine
394,Voluntarily causing hurt in committing robbery,"Aggravated form of robbery where hurt is voluntarily caused, punished with imprisonment for life or imprisonment up to 10 years and fine"
395,Punishment for dacoity,Punishes dacoity with imprisonment for life or rigorous imprisonment up to 10 years and fine
396,Dacoity with murder,"Aggravated form of dacoity when any person is murdered, punished with death, imprisonment for life, or rigorous imprisonment up to 10 years and fine"
397,"Robbery, or dacoity, with attempt to cause death or grievous hurt","Aggravated form of robbery or dacoity when grievous hurt is caused or attempted, punished with imprisonment not less than 7 years"
398,Attempt to commit robbery or dacoity when armed with deadly weapon,"Attempted robbery or dacoity when offender is armed with deadly weapon, punished with imprisonment not less than 7 years"
399,Making preparation to commit dacoity,Punishes making preparation for dacoity with rigorous imprisonment up to 10 years and fine
400,Punishment for belonging to gang of dacoits,Punishes being member of gang of dacoits with imprisonment for life or rigorous imprisonment up to 10 years and fine
401,Punishment for belonging to gang of thieves,Punishes being member of gang of thieves with rigorous imprisonment up to 7 years and fine
402,Assembling for purpose of committing dacoity,Punishes assembling for the purpose of committing dacoity with rigorous imprisonment up to 7 years and fine
403,Dishonest misappropriation of property,"Defines and punishes offence of dishonest misappropriation of movable property with imprisonment up to 2 years, or fine or both"
404,Dishonest misappropriation of property possessed by deceased person at the time of his death,"Aggravated form of offence when property is misappropriated that is possessed by deceased person, punished with imprisonment up to 3 years and fine"
405,Criminal breach of trust,"Defines and punishes criminal breach of trust with imprisonment up to 3 years, or fine, or both"
406,Punishment for criminal breach of trust,"Whoever commits criminal breach of trust shall be punished with imprisonment of either description for a term which may extend to three years, or with fine, or with both."
407,"Criminal breach of trust by carrier, etc.","Whoever, being entrusted with property as a carrier, wharfinger or warehouse-keeper, commits criminal breach of trust in respect of such property, shall be punished with imprisonment of either description for a term which may extend to seven years, and shall also be liable to fine."
408,Criminal breach of trust by clerk or servant,"Whoever, being a clerk or servant or employed as a clerk or servant, and being in any manner entrusted in such capacity with property, or with any dominion over property, commits criminal breach of trust in respect of that property, shall be punished with imprisonment of either description for a term which may extend to seven years, and shall also be liable to fine."
409,"Criminal breach of trust by public servant, or by banker, merchant or agent","Whoever, being in any manner entrusted with property, or with any dominion over property in his capacity of a public servant or in the way of his business as a banker, merchant, factor, broker, attorney or agent, commits criminal breach of trust in respect of that property, shall be punished with imprisonment for life, or with imprisonment of either description for a term which may extend to ten years, and shall also be liable to fine."
410,Stolen property,"the possession whereof has been transferred by theft, or by  extortion, or by robbery, and property which has been criminally misappropriated or in respect of which  criminal breach of trust has been committed, is designated as “stolen property”"
411,Dishonestly receiving stolen property,"Whoever dishonestly receives or retains any stolen property, knowing or having reason to believe the same to be stolen property, shall be punished with imprisonment of either description for a term which may extend to three years, or with fine, or with both."
412,Dishonestly receiving property stolen in the commission of a dacoity,"Whoever dishonestly receives or retains any stolen property, the possession whereof he knows or has reason to believe to have been transferred by the commission of dacoity, or dishonestly receives from a person, whom he knows or has reason to believe to belong or to have belonged to a gang of dacoits, property which he knows or has reason to believe to have been stolen, shall be punished with imprisonment for life, or with rigorous imprisonment for a term which may extend to ten years, and shall also be liable to fine."
413,Habitually dealing in stolen property,"Whoever habitually receives or deals in property which he knows or has reason to believe to be stolen property, shall be punished with imprisonment for life, or with imprisonment of either description for a term which may extend to ten years, and shall also be liable to fine."
414,Assisting in concealment of stolen property,"Whoever voluntarily assists in concealing or disposing of or making away with property which he knows or has reason to believe to be stolen property, shall be punished with imprisonment of either description for a term which may extend to three years, or with fine, or with both."
415,Cheating,"Whoever, by deceiving any person, fraudulently or dishonestly induces the person so deceived to deliver any property to any person, or to consent that any person shall retain any property, or intentionally induces the person so deceived to do or omit to do anything which he would not do or omit if he were not so deceived, and which act or omission causes or is likely to cause damage or harm to that person in body, mind, reputation or property, is said to “cheat”."
416,Cheating by personation,"A person is said to “cheat by personation” if he cheats by pretending to be some other person, or by knowingly substituting one person for another, or representing that he or any other person is a person other than he or such other person really is."
417,Punishment for cheating,"Whoever cheats shall be punished with imprisonment of either description for a term which may extend to one year, or with fine, or with both."
418,Cheating with knowledge that wrongful loss may ensue to person whose interest offender is bound to protect,"Whoever cheats with the knowledge that he is likely thereby to cause wrongful loss to a person whose interest in the transaction to which the cheating relates, he was bound, either by law, or by a legal contract, to protect, shall be punished with imprisonment of either description for a term which may extend to three years, or with fine, or with both."
419,Punishment for cheating by personation,"Whoever cheats by personation shall be punished with imprisonment of either description for a term which may extend to three years, or with fine, or with both."
420,Cheating and dishonestly inducing delivery of property,"Whoever cheats and thereby dishonestly induces the person deceived to deliver any property to any person, or to make, alter or destroy the whole or any part of a valuable security, or anything which is signed or sealed, and which is capable of being converted into a valuable security, shall be punished with imprisonment of either description for a term which may extend to seven years, and shall also be liable to fine."
421,Dishonest or fraudulent removal or concealment of property to prevent distribution among creditors,"Whoever dishonestly or fraudulently removes, conceals or delivers to any person, or transfers or causes to be transferred to any person, without adequate consideration, any property, intending thereby to prevent, or knowing it to be likely that he will thereby prevent, the distribution of that property according to law among his creditors or the creditors of any other person, shall be punished with imprisonment of either description for a term which may extend to two years, or with fine, or with both."
422,Dishonestly or fraudulently preventing debt being available for creditors,"Whoever dishonestly or fraudulently prevents any debt or demand due to himself or to any other person from being made available according to law for payment of his debts or the debts of such other person, shall be punished with imprisonment of either description for a term which may extend to two years, or with fine, or with both."
423,Dishonest or fraudulent execution of deed of transfer containing false statement of consideration,"Whoever dishonestly or fraudulently signs, executes or becomes a party to any deed or instrument which purports to transfer or subject to any charge any property, or any interest therein, and which contains any false statement relating to the consideration for such transfer or charge, or relating to the person or persons for whose use or benefit it is really intended to operate, shall be punished with imprisonment of either description for a term which may extend to two years, or with fine, or with both."
424,Dishonest or fraudulent removal or concealment of property,"Whoever dishonestly or fraudulently conceals or removes any property of himself or any other person, or dishonestly releases any demand or claim to which he is entitled, shall be punished with imprisonment of either description for a term which may extend to two years, or with fine, or with both."
425,Mischief,"Defines mischief as causing loss/damage to public or any person by destroying property, etc. with intention or knowledge"
426,Punishment for mischief,"Punishes mischief with imprisonment up to 3 months, or fine, or both"
427,Mischief causing damage to the amount of fifty rupees,"Punishes mischief causing loss/damage amounting to Rs. 50 or more, with imprisonment up to 2 years, or fine, or both"
428,Mischief by killing or maiming animal of the value of ten rupees,"Punishes mischief by killing/maiming animal worth Rs. 10 or more, with imprisonment up to 2 years, or fine, or both"
429,"Mischief by killing or maiming cattle, etc., of any value or any animal of the value of fifty rupees","Punishes mischief by killing/maiming elephant, camel, horse, etc. or animal worth Rs. 50 or more, with imprisonment up to 5 years, or fine, or both"
430,Mischief by injury to works of irrigation or by wrongfully diverting water,"Punishes mischief by injury to public irrigation works or diverting water, with imprisonment up to 5 years, or fine, or both"
431,"Mischief by injury to public road, bridge, river or channel","Punishes mischief to public road, bridge, river injuring safety/convenience of passage, with imprisonment up to 5 years, or fine, or both"
432,Mischief by causing inundation or obstruction to public drainage attended with damage,"Punishes mischief causing inundation or obstruction to public drainage, with imprisonment up to 5 years, or fine, or both"
433,"Mischief by destroying, moving or rendering less useful a lighthouse or sea-mark","Punishes mischief to lighthouse, sea-mark, buoy or other navigational aid, with imprisonment up to 7 years, or fine, or both"
434,"Mischief by destroying or moving, etc., a land mark fixed by public authority","Punishes mischief by destroying or moving landmark fixed by public authority, with imprisonment up to 1 year, or fine, or both"
435,Mischief by fire or explosive substance with intent to cause damage to amount of one hundred or (in case of agricultural produce) ten rupees,"Punishes mischief by fire, etc. intending to cause Rs. 100 or more loss, or loss of Rs. 10 or more to agricultural produce, with imprisonment up to 7 years and fine"
436,"Mischief by fire or explosive substance with intent to destroy house, etc","Punishes mischief by fire, etc. intending to destroy building used as place of worship, human dwelling or custody of property, with imprisonment for life, or imprisonment up to 10 years and fine"
437,Mischief with intent to destroy or make unsafe a decked vessel or one of twenty tons burden,"Punishes mischief to decked vessel intending to destroy or render unsafe vessel of 20 tons burden or more, with imprisonment up to 10 years and fine"
438,Punishment for the mischief described in section 437 committed by fire or explosive substance,"Punishes mischief described in section 437 when committed by fire, etc., with imprisonment for life, or imprisonment up to 10 years and fine"
439,"Punishment for intentionally running vessel aground or ashore with intent to commit theft, etc.","Punishes intentionally running vessel aground or ashore to commit theft, mischief, etc. or facilitate such offence, with imprisonment up to 10 years and fine"
440,Mischief committed after preparation made for causing death or hurt,"Aggravated form of mischief after preparation made to cause death/hurt, punished with imprisonment up to 5 years and fine"
441,Criminal trespass,Defines criminal trespass as trespass to any property with intent to commit an offence or intimidate/annoy any person
442,House-trespass,"Defines house-trespass as criminal trespass into a building used as human dwelling or place of worship, etc."
443,Lurking house-trespass,Defines lurking house-trespass as house-trespass after taking precautions to conceal the offence
444,Lurking house-trespass by night,Defines aggravated form of lurking house-trespass committed after sunset and before sunrise
445,House-breaking,Defines house-breaking as committing house-trespass by effecting certain kinds of entry
446,House-breaking by night,Defines aggravated form of house-breaking committed after sunset and before sunrise
447,Punishment for criminal trespass,"Punishes criminal trespass with imprisonment up to 3 months, or fine up to Rs. 500, or both"
448,Punishment for house-trespass,"Punishes house-trespass with imprisonment up to 1 year, or fine up to Rs. 1000, or both"
449,House-trespass in order to commit offence punishable with death,"Punishes house-trespass to commit capital offence, with imprisonment for life, or rigorous imprisonment up to 10 years and fine"
450,House-trespass in order to commit offence punishable with imprisonment for life,"Punishes house-trespass to commit offence punishable with imprisonment for life, with imprisonment up to 10 years and fine"
451,House-trespass in order to commit offence punishable with imprisonment,"Punishes house-trespass to commit offence punishable with imprisonment, with imprisonment up to 2 years and fine, up to 7 years if offence is theft"
452,"House-trespass alter preparation for hurt, assault or wrongful restraint","Aggravated form of house-trespass after preparation made for hurt, assault, wrongful restraint, etc. with imprisonment up to 7 years and fine"
453,Punishment for lurking house-trespass or house-breaking,Punishes lurking house-trespass and house-breaking with imprisonment up to 2 years and fine
454,Lurking house-trespass or house-breaking in order to commit offence punishable with imprisonment,"Punishes aggravated form of lurking house-trespass/house-breaking to commit offence punishable with imprisonment, with imprisonment up to 3 years and fine, up to 10 years if offence is theft"
455,"Lurking house-trespass or house-breaking after preparation for hurt, assault or wrongful restraint","Aggravated form of lurking house-trespass/house-breaking after preparation for hurt, assault, wrongful restraint, etc., with imprisonment up to 10 years and fine"
456,Punishment for lurking house-trespass or house-breaking by night,"Punishes aggravated form of lurking house-trespass/house-breaking by night, with imprisonment up to 3 years and fine"
457,Lurking house-trespass or house-breaking by night in order to commit offence punishable with imprisonment,"Punishes aggravated form of lurking house-trespass/house-breaking by night to commit offence punishable with imprisonment, with imprisonment up to 5 years, up to 14 years if offence is theft"
458,"Lurking house-trespass or house-breaking by night after preparation for hurt, assault, or wrongful restraint","Aggravated form of lurking house-trespass/house-breaking by night after preparation for hurt, assault or wrongful restraint, etc., with imprisonment up to 14 years and fine"
459,Grievous hurt caused whilst committing lurking house-trespass or house-breaking,"Punishes causing grievous hurt whilst committing lurking house-trespass/house-breaking with imprisonment for life, or imprisonment up to 10 years and fine"
460,All persons jointly concerned in lurking house-trespass or house-breaking by night punishable where death or grievous hurt caused by one of them,"Punishes all persons jointly committing lurking house-trespass/house-breaking by night when death/grievous hurt is caused by one of them, with imprisonment for life, or imprisonment up to 10 years and fine"
