Section,Title,Description
1,Title and extent of operation of the Code,Defines the title of the code as 'The Indian Penal Code' and states that it extends to whole of India except Jammu and Kashmir
2,Punishment of offences committed within India,"States that every person shall be liable for punishment for every act or omission contrary to the code provisions, committed within India"
3,"Punishment of offences committed beyond, but which by law may be tried within, India",Specifies that any person liable to be tried for an offence committed beyond India shall be dealt with according to the Code provisions
4,Extension of Code to extra-territorial offences,Applies the Code provisions to offences committed outside India by Indian citizens or persons on aircrafts/ships registered in India
5,Certain laws not to be affected by this Act,"Specifies that the Code provisions do not affect laws related to mutiny, desertion of armed forces personnel or other special/local laws"
6,Definitions in the Code to be understood subject to exceptions,Specifies that definitions and explanations in the Code are subject to general exceptions even if not explicitly mentioned
7,Sense of expression once explained,Specifies that any expression explained in one part of the Code applies to all other parts
8,Gender,Defines usage of pronoun 'he' and derivatives for both genders
9,Number,"Specifies singular words include plural and vice-versa, unless explicitly mentioned"
10,"""Man"", ""Woman""","Defines ""man"" and ""woman"" as male and female human beings respectively"
11,"""Person""","Includes companies, associations, groups as persons"
12,"""Public""",Includes any class or community
13,[Definition of “Queen”],Omitted
14,"""Servant of Government""",Denotes government officials or servants appointed by government
15,[Definition of “British India”],Repealed
16,[Definition of “Government of India”],Repealed
17,"""Government""",Denotes Central Government or State Government
18,"""India""",Means India excluding Jammu and Kashmir
19,"""Judge""",Denotes persons empowered to act judicially or give legal judgments
20,"""Court of Justice”",Denotes Judges empowered to act judicially as a body
21,“Public servant”,Provides definitions and explanations of public servants
22,“Movable property”,Denotes corporeal property except land or things attached to earth
23,“Wrongful gain”/”Wrongful loss”,Defines wrongful gain and loss relating to property
24,“Dishonestly”,Specifies acts done to cause wrongful gain/loss to others as dishonest
25,“Fraudulently”,Specifies acts done to defraud others as fraudulent
26,“Reason to believe”,Defines having reasonable cause for belief
27,"Property in possession of wife, clerk or servant",Specifies property in others' possession deemed as own
28,“Counterfeit”,Defines causing resemblance to practice deception as counterfeiting
29,“Document”,"Defines documents as evidence expressed in letters, figures etc."
29A,“Electronic record”,Defines electronic records for information stored electronically
30,“Valuable security”,Denotes documents conveying legal rights or liability
31,“A will”,Denotes any testamentary document
32,Words referring to acts include illegal omissions,Specifies words for acts include omissions
33,"“Act”, “Omission”","Defines act as series of acts or single act, and omission accordingly"
34,Acts done by several persons in furtherance of common intention,Specifies liability when criminal act is done by many people together
35,When such an act is criminal by reason of its being done with a criminal knowledge or intention,Specifies liability when above act is done knowingly/intentionally
36,Effect caused partly by act and partly by omission,Equalizes part act and part omission for an offence
37,Co-operation by doing one of several acts constituting an offence,Specifies liability for intentionally cooperating in commission of an offence
38,Persons concerned in criminal act may be guilty of different offences,Specifies different liabilities for different people involved in a criminal act
39,“Voluntarily”,Explains when an effect is caused voluntarily.
40,“Offence”,Defines what constitutes an offence under various sections.
41,“Special law”,Definition of a special law applicable to a particular subject.
42,“Local law”,Definition of a local law applicable to a specific part of India.
43,"“Illegal”, “Legally bound to do”","Definitions of ""illegal"" and when a person is legally bound to do something."
44,“Injury”,"Definition of the term ""injury"" in context of harm to body, mind, reputation, or property."
45,“Life”,"Definition of ""life"" in the legal context."
46,“Death”,"Definition of ""death"" in the legal context."
47,“Animal”,"Definition of ""animal"" excluding human beings."
48,“Vessel”,"Definition of ""vessel"" for conveyance by water."
49,"“Year”, “Month”","Explanation of how ""year"" and ""month"" are reckoned."
50,“Section”,"Definition of the term ""section"" in the context of IPC chapters."
51,“Oath”,Includes solemn affirmations and declarations in legal context.
52,“Good faith”,"Definition of actions done in ""good faith""."
52A,“Harbour”,"Definition of ""harbour"" in legal terms."
53,Punishments,"Specifies the types of punishments under IPC, including death, imprisonment, forfeiture of property, and fine."
54,Commutation of sentence of death,Allows the appropriate government to commute a death sentence to any other punishment provided by the Code.
55,Commutation of sentence of imprisonment for life,Allows the appropriate government to commute a life imprisonment sentence to a term not exceeding 14 years.
55A,Definition of “appropriate Government”,Defines “appropriate Government” in the context of sections 54 and 55.
56,[Repealed],This section was repealed.
57,Fractions of terms of punishment,Imprisonment for life is reckoned as equivalent to imprisonment for twenty years for calculating fractions of terms.
58,[Repealed],This section was repealed.
59,[Repealed],This section was repealed.
60,Sentence may be (in certain cases of imprisonment) wholly or partly rigorous or simple,Specifies the nature of imprisonment sentences.
61,[Repealed],This section was repealed.
62,[Repealed],This section was repealed.
63,Amount of fine,"If no sum is expressed to which a fine may extend, the amount is unlimited but not excessive."
64,Sentence of imprisonment for non-payment of fine,Specifies imprisonment terms in cases of non-payment of fines.
65,Limit to imprisonment for non-payment of fine,Limits the term for imprisonment in default of payment of a fine.
66,Description of imprisonment for non-payment of fine,Specifies the description of imprisonment for non-payment of a fine.
67,Imprisonment for non-payment of fine when offence punishable with fine only,Specifies terms for imprisonment in default of payment of fine for offences punishable with fine only.
68,Imprisonment to terminate on payment of fine,Specifies that imprisonment for non-payment of fine terminates upon payment of the fine.
69,Termination of imprisonment on payment of proportional part of fine,Specifies conditions under which imprisonment for non-payment of fine can be terminated.
70,Fine leviable within six years or during imprisonment,Specifies the period within which a fine can be levied.
71,Limit of punishment of offence made up of several offences,"Limits punishment in cases where an act is made up of parts, each of which is an offence."
72,"Punishment of person guilty of one of several offences, the judgment stating that it is doubtful of which",Specifies punishment in cases where it is doubtful of which of several offences the person is guilty.
73,Solitary confinement,Specifies the conditions under which solitary confinement can be ordered.
74,Limit of solitary confinement,Limits the duration of solitary confinement.
75,Enhanced punishment for certain offences after previous conviction,Specifies enhanced punishment for repeated offences under certain chapters.
76,"Act done by a person bound, or by mistake of fact believing himself bound, by law",No offence is committed if an act is done by someone who believes in good faith that they are legally bound to do it.
77,Act of Judge when acting judicially,No offence is committed by a Judge when acting judicially in the exercise of any power given by law.
78,Act done pursuant to the judgment or order of Court,No offence is committed if an act is done following a judgment or order of a Court.
79,"Act done by a person justified, or by mistake of fact believing himself justified, by law","No offence is committed by a person who does an act in good faith, believing themselves legally justified."
80,Accident in doing a lawful act,No offence is committed if an act is done by accident or misfortune without any criminal intention or knowledge.
81,"Act likely to cause harm, but done without criminal intent, and to prevent other harm",No offence is committed if an act is done without criminal intent to prevent or avoid other harm.
82,Act of a child under seven years of age,An act done by a child under seven years of age is not an offence.
83,Act of a child above seven and under twelve of immature understanding,"An act done by a child above seven but under twelve, who has not attained sufficient maturity of understanding, is not considered an offence."
84,Act of a person of unsound mind,"No offence is committed by a person who, at the time of doing it, is incapable of knowing the nature of the act due to unsoundness of mind."
85,Act of a person incapable of judgment by reason of intoxication caused against his will,"An act done by a person who, at the time of doing it, is incapable of knowing the nature of the act due to involuntary intoxication, is not an offence."
86,Offence requiring a particular intent or knowledge committed by one who is intoxicated,"In cases where an act requires a specific intent or knowledge, the fact that the person doing the act was intoxicated is irrelevant."
87,"Act not intended and not known to be likely to cause death or grievous hurt, done by consent","No offence is committed if an act not intended to cause death or grievous hurt, and not known to be likely to cause death or grievous hurt, is done by consent."
88,Act not intended to cause death done by consent in good faith for person's benefit,Any act not intended to cause death is not an offence if it is done in good faith for someone's benefit with their consent.
89,Act done in good faith for benefit of child or insane person by or by consent of guardian,Acts done in good faith for the benefit of a child under twelve or an insane person are not offences if done with the guardian's consent.
90,Consent known to be given under fear or misconception,A consent given under fear or misconception is not considered valid in the eyes of the law.
91,Exclusion of acts which are offences independently of harm caused,"Exceptions in sections 87, 88, and 89 do not extend to acts that are offences independently of any harm caused."
92,Act done in good faith for benefit of a person without consent,An act done in good faith for someone's benefit without their consent is not an offence if it is impossible to obtain consent in time to be beneficial.
93,Communication made in good faith,No communication made in good faith is an offence by reason of any harm to the person to whom it is made if it is made for their benefit.
94,Act to which a person is compelled by threats,"Except for murder and certain offences against the state punishable with death, nothing is an offence if done by a person compelled by threats of instant death."
95,Act causing slight harm,"Nothing is an offence by reason that it causes, or is intended to cause, harm if that harm is so slight that no person of ordinary sense and temper would complain of such harm."
96,Things done in private defence,Nothing is an offence which is done in the exercise of the right of private defence.
97,Right of private defence of the body and of property,"Every person has the right, subject to the restrictions contained in section 99, to defend their own body and the body of any other person against certain offences."
98,"Right of private defence against the act of a person of unsound mind, etc.—","When an act, which would otherwise be a certain offence, is not that offence, by reason of the youth, the want of maturity of understanding, the unsoundness of mind or the intoxication of the person doing that act, or by reason of any misconception on the part of that person, every person has the same right of private defence against that act which he would have if the act were that offence."
99,Acts against which there is no right of private defence,"There is no right of private defence against an act which does not reasonably cause the apprehension of death or of grievous hurt, if done, or attempted to be done, by a public servant acting in good faith under colour of his office, though that act, may not be strictly justifiable by law."
100,When the right of private defence of the body extends to causing death,"The right of private defence of the body extends, under the restrictions mentioned in the last preceding section, to the voluntary causing of death or of any other harm to the assailant, if the offence which occasions the exercise of the right be of any of the descriptions hereinafter enumerated, namely:"
101,When such right extends to causing any harm other than death,"If the offence be not of any of the descriptions enumerated in the last preceding section, the right of private defence of the body does not extend to the voluntary causing of death to the assailant, but does extend, under the restrictions mentioned in section 99, to the voluntary causing to the assailant of any harm other than death."
102,Commencement and continuance of the right of private defence of the body,The right of private defence of the body commences as soon as a reasonable apprehension of danger to the body arises from an attempt or threat to commit the offence though the offence may not have been committed; and it continues as long as such apprehension of danger to the body continues.
103,When the right of private defence of property extends to causing death,"The right of private defence of property extends, under the restrictions mentioned in section 99, to the voluntary causing of death or of any other harm to the wrong-doer, if the offence, the committing of which, or the attempting to commit which, occasions the exercise of the right, be an offence of any of the descriptions hereinafter enumerated, namely:"
104,When such right extends to causing any harm other than death,"If the offence, the committing of which, or the attempting to commit which occasions the exercise of the right of private defence, be theft, mischief, or criminal trespass, not of any of the descriptions enumerated in the last preceding section, that right does not extend to the voluntary causing of death, but does extend, subject to the restrictions mentioned in section 99, to the voluntary causing to the wrong-doer of any harm other than death."
105,Commencement and continuance of the right of private defence of property,"The right of private defence of property commences when a reasonable apprehension of danger to the property commences. The right of private defence of property against theft continues till the offender has effected his retreat with the property or either the assistance of the public authorities is obtained, or the property has been recovered."
106,Right of private defence against deadly assault when there is risk of harm to innocent person,"If in the exercise of the right of private defence against an assault which reasonably causes the apprehension of death, the defender be so situated that he cannot effectually exercise that right without risk of harm to an innocent person, his right of private defence extends to the running of that risk."
107,Abetment of a thing,"A person abets the doing of a thing, who: Instigates any person to do that thing; or Engages with one or more other person or persons in any conspiracy for the doing of that thing, if an act or illegal omission takes place in pursuance of that conspiracy, and in order to the doing of that thing; or Intentionally aids, by any act or illegal omission, the doing of that thing."
108,Abettor,"A person abets an offence, who abets either the commission of an offence, or the commission of an act which would be an offence, if committed by a person capable by law of committing an offence with the same intention or knowledge as that of the abettor."
109,Punishment of abetment if the act abetted is committed in consequence and where no express provision is made for its punishment,"Whoever abets any offence shall, if the act abetted is committed in consequence of the abetment, and no express provision is made by this Code for the punishment of such abetment, be punished with the punishment provided for the offence."
110,Punishment of abetment if person abetted does act with different intention from that of abettor,"Whoever abets the commission of an offence shall, if the person abetted does the act with a different intention or knowledge from that of the abettor, be punished with the punishment provided for the offence which would have been committed if the act had been done with the intention or knowledge of the abettor and with no other."
111,Liability of abettor when one act abetted and different act done,"When an Act is abetted and a different act is done, the abettor is liable for the act done, in the same manner and to the same extent as if he had directly abetted it:"
112,Abettor when liable to cumulative punishment for act abetted and for act done,"If the act for which the abettor is liable under the last preceding section is committed in addition to the act abetted, and constitute a distinct offence, the abettor is liable to punishment for each of the offences."
113,Liability of abettor for an effect caused by the act abetted different from that intended by the abettor,"When an act is abetted with the intention on the part of the abettor of causing a particular effect, and an act for which the abettor is liable in consequence of the abetment, causes a different effect from that intended by the abettor, the abettor is liable for the effect caused, in the same manner and to the same extent as if he had abetted the act with the intention of causing that effect, provided he knew that the act abetted was likely to cause that effect."
114,Abettor present when offence is committed,"Whenever any person, who is absent would be liable to be punished as an abettor, is present when the act or offence for which he would be punishable in consequence of the abetment is committed, he shall be deemed to have committed such act or offence."
115,Abetment of offence punishable with death or imprisonment for life.—if offence not committed,"Whoever abets the commission of an offence punishable with death or imprisonment for life, shall, if that offence be not committed in consequence of the abetment, and no express provision is made by this Code for the punishment of such abetment, be punished with imprisonment of either description for a term which may extend to seven years, and shall also be liable to fine;"
116,Abetment of offence punishable with imprisonment—if offence be not committed,"Whoever abets an offence punishable with imprisonment shall, if that offence be not committed in consequence of the abetment, and no express provision is made by this Code for the punishment of such abetment, be punished with imprisonment of any description provided for that offence for a term which may extend to one-fourth part of the longest term provided for that offence; or with such fine as is provided for that offence, or with both;"
117,Abetting commission of offence by the public or by more than ten persons,"Whoever abets the commission of an offence by the public generally or by any number or class of persons exceeding ten, shall be punished with imprisonment of either description for a term which may extend to three years, or with fine, or with both."
118,Concealing design to commit offence punishable with death or imprisonment for life,"Whoever intending to facilitate or knowing it to be likely that he will thereby facilitate the commission of an offence punishable with death or imprisonment for life, voluntarily conceals, by any act or illegal omission, or by the use of encryption or any other information hiding tool, the existence of a design to commit such offence or makes any representation which he knows to be false respecting such design,shall, if that offence be committed, be punished with imprisonment of either description for a term which may extend to seven years, or, if the offence be not committed, with imprisonment of either description, for a term which may extend to three years; and in either case shall also be liable to fine."
119,Public servant concealing design to commit offence which it is his duty to prevent,"Whoever, being a public servant intending to facilitate or knowing it to be likely that he will thereby facilitate the commission of an offence which it is his duty as such public servant to prevent, voluntarily conceals, by any act or illegal omission or by the use of encryption or any other information hiding tool, the existence of a design to commit such offence, or makes any representation which he knows to be false respecting such design, shall, if that offence be committed, be punished with imprisonment of any description provided for the offence, for a term which may extend to one-half of the longest term of such imprisonment, or with such fine as is provided for that offence, or with both; or, if the offence be punishable with death or imprisonment for life, with imprisonment of either description for a term which may extend to ten years; or, if the offence be not committed, shall be punished with imprisonment of any description provided for the offence for a term which may extend to one-fourth part of the longest term of such imprisonment or with such fine as is provided for the offence, or with both."
120,Concealing design to commit offence punishable with imprisonment,"Whoever, intending to facilitate or knowing it to be likely that he will thereby facilitate the commission of an offence punishable with imprisonment, voluntarily conceals, by any act or illegal omission, the existence of a design to commit such offence, or makes any representation which he knows to be false respecting such design, shall, if that offence be committed, be punished with imprisonment of the description provided for the offence, for a term which may extend to one-fourth, and, if the offence be not committed, to one-eighth, of the longest term of such imprisonment, or with such fine as is provided for the offence, or with both."
121,"Waging, or attempting to wage war, or abetting waging of war, against the Government of India","Whoever wages war against the Government of India, or attempts to wage such war, or abets the waging of such war, shall be punished with death, or imprisonment for life and shall also be liable to fine"
122,"Collecting arms, etc., with intention of waging war against the Government of India","Whoever collects men, arms or ammunition or otherwise prepares to wage war with the intention of either waging or being prepared to wage war against the Government of India, shall be punished with imprisonment for life or imprisonment of either description for a term not exceeding ten years, and shall also be liable to fine."
123,Concealing with intent to facilitate design to wage war,"Whoever by any act, or by any illegal omission, conceals the existence of a design to wage war against the Government of India, intending by such concealment to facilitate, or knowing it to be likely that such concealment will facilitate, the waging of such war, shall be punished with imprisonment of either description for a term which may extend to ten years, and shall also be liable to fine."
124,"Assaulting President, Governor, etc., with intent to compel or restrain the exercise of any lawful power","Whoever, with the intention of inducing or compelling the President of India, or Governor of any State, to exercise or refrain from exercising in any manner any any of the lawful powers of such President or Governor, assaults or wrongfully restrains, or attempts wrongfully to restrain, or overawes, by means of criminal force or the show of criminal force, or attempts so to overawe, such President or Governor, shall be punished with imprisonment of either description for a term which may extend to seven years, and shall also be liable to fine."
125,Waging war against any Asiatic Power in alliance with the Government of India,"Whoever wages war against the Government of any Asiatic Power in alliance or at peace with the Government of India or attempts to wage such war, or abets the waging of such war, shall be punished with imprisonment for life, to which fine may be added, or with imprisonment of either description for a term which may extend to seven years, to which fine may be added, or with fine."
126,Committing depredation on territories of Power at peace with the Government of India,"Whoever commits depredation, or makes preparations to commit depredation, on the territories of any Power in alliance or at peace with the Government of India, shall be punished with imprisonment of either description for a term which may extend to seven years, and shall also be liable to fine and to forfeiture of any property used or intended to be used in committing such depredation, or acquired by such depredation."
